{
  "schema_version": 2,
  "request_id": "ARQ-brainstorm-v2-example",
  "adapter_id": "brainstorm-adapter",
  "host_ref": "brainstorm:example",
  "host_write_target_ref": "brainstorm:example#analysis",
  "created_at": "2026-09-08T00:00:00Z",
  "intent": "analyze",
  "goal": "检查共享资源是否同时满足需求；合成接线示例",
  "allowed_sources": [
    "project"
  ],
  "input_refs": [
    "brainstorm:example#resources"
  ],
  "constraints": [
    "保留宿主已锁定决定；此样例不是实际项目验收"
  ],
  "budget": {
    "time_minutes": 10,
    "tool_calls": 4
  }
}
